{"schemaVersion":"1.0.0","manifestId":"nara-playbook-trust","manifestVersion":"1.1.0","environment":"development","issuedAtUtc":"2026-08-14T00:00:00Z","expiresAtUtc":"2027-08-14T00:00:00Z","keys":[{"keyId":"nara-stage2-dev-2026","purpose":"playbook-signing","algorithm":"ecdsa-p256-sha256","publicKeySpkiBase64":"MFkwEwYHKoZIzj0CAQYIKoZIzj0DAQcDQgAEhYyghaqN2RmpsNQttc4So3GwMm2a3fNSpUcdIL0DFRulaZLJaXPbpHHx6XGHdw77iti0SnDdhKWvCAoU71ofOw==","status":"retired","notBeforeUtc":"2026-08-14T00:00:00Z","notAfterUtc":"2027-08-14T00:00:00Z"},{"keyId":"nara-stage2-rotated-2026","purpose":"playbook-signing","algorithm":"ecdsa-p256-sha256","publicKeySpkiBase64":"MFkwEwYHKoZIzj0CAQYIKoZIzj0DAQcDQgAEDyBdinJgmf5BJ9ii7QfBghiZTOf4JHwtGOhmWiIDYGK75ts0EihUtPDuNdvB436zVY2euqziJIhdlEOSJsi0BQ==","status":"active","notBeforeUtc":"2026-08-14T00:00:00Z","notAfterUtc":"2027-08-14T00:00:00Z"}],"revokedKeyIds":[]}
